### ISSUE TITLE
NUXT_NOMINATIM_BASEURL 环境变量不生效

### ISSUE THREAD

**Issue by kiosk404** [HoshinoSuzumi/chronoframe#158]
### 问题描述
- 预期行为：`.env` 配置了 `NUXT_NOMINATIM_BASEURL` ，预期不再访问 nominatim.openstreetmap.org , 而是访问我本地代理域名 nominatim-proxy.com。
- 实际行为：还是访问的源域名 nominatim.openstreetmap.org
- 复现频率：必现

例如：
配置 `NUXT_NOMINATIM_BASEURL=http://nominatim-proxy.com` 后，系统仍使用默认的 `nominatim.openstreetmap.org` 进行地理编码请求，环境变量未生效。每次重启服务后问题均复现。

### 复现步骤
1. 在 `.env` 文件中设置 `NUXT_NOMINATIM_BASEURL=http://nominatim-proxy.com`
2. 注释所有 Mapbox 相关配置
3. 执行 `docker compose up -d --build` 启动服务
4. 上传一张带有 GPS 信息的照片，观察日志

### 预期结果
系统应使用 `http://nominatim-proxy.com` 作为地理编码服务地址。

### 实际结果
1. docker 中实际环境变量已生效, 且代理域名是可以正常访问的。
```bash
docker exec -it chronoframe /bin/sh                                  
/app # echo $NUXT_NOMINATIM_BASEURL
http://nominatim-proxy.com

/app # wget -qO- "http://nominatim-proxy.com/search?q=tokyo&format=json"
[{"place_id":241611141,"licence":"Data © OpenStreetMap contributors, ODbL 1.0. http://osm.org/copyright","osm_type":"relation","osm_id":1543125,"lat":"35.6768601","lon":"139.7638947","class":"boundary","type":"administrative","place_rank":8,"importance":0.82108616521785,"addresstype":"province","name":"東京都","display_name":"東京都, 日本","boundingbox":["20.2145811","35.8984245","135.8536855","154.2055410"]}]
```
2. 通过tcpdump抓包可得，内部依旧访问的是 `nominatim.openstreetmap.org`
```bash
➜  chronoframe  sudo tcpdump -i any -s 0 -n -vvv -l -A udp port 53 2>/dev/null | grep --line-buffered -i 'nominatim.openstreetmap.org'
    127.0.0.1.49698 > 127.0.0.1.53: [bad udp cksum 0xfe48 -> 0x88d2!] 62550+ A? nominatim.openstreetmap.org. (45)
E..Iz.@.@............".5.5.H.V..........	nominatim.openstreetmap.org.....
    127.0.0.1.42154 > 127.0.0.1.53: [bad udp cksum 0xfe48 -> 0x88a7!] 63225+ AAAA? nominatim.openstreetmap.org. (45)
E..I$W@.@..K...........5.5.H............	nominatim.openstreetmap.org.....
    127.0.0.1.53 > 127.0.0.1.49698: [bad udp cksum 0xfe58 -> 0xc40b!] 62550 q: A? nominatim.openstreetmap.org. 1/0/0 nominatim.openstreetmap.org. [3s] A 31.13.70.33 (61)
E..Y3a@.@.	..........5.".E.X.V..........	nominatim.openstreetmap.org...................F!
    192.168.31.86.38219 > 119.29.29.29.53: [bad udp cksum 0x748a -> 0x9c7c!] 34573+ [1au] A? nominatim.openstreetmap.org. ar: . OPT UDPsize=4096 (56)
E..T}.@....K...Vw....K.5.@t.............	nominatim.openstreetmap.org.......)........
    192.168.31.86.35102 > 223.5.5.5.53: [bad udp cksum 0xc45a -> 0x58d9!] 34573+ [1au] A? nominatim.openstreetmap.org. ar: . OPT UDPsize=4096 (56)
E..T..@....u...V.......5.@.Z............	nominatim.openstreetmap.org.......)........
    192.168.31.86.38219 > 119.29.29.29.53: [bad udp cksum 0x748a -> 0x41d9!] 50864+ [1au] AAAA? nominatim.openstreetmap.org. ar: . OPT UDPsize=4096 (56)
E..T}.@....J...Vw....K.5.@t.............	nominatim.openstreetmap.org.......)........
    192.168.31.86.35102 > 223.5.5.5.53: [bad udp cksum 0xc45a -> 0xfe35!] 50864+ [1au] AAAA? nominatim.openstreetmap.org. ar: . OPT UDPsize=4096 (56)
E..T..@....t...V.......5.@.Z............	nominatim.openstreetmap.org.......)........
    127.0.0.1.53 > 127.0.0.1.42154: [bad udp cksum 0xfe64 -> 0xde17!] 63225 q: AAAA? nominatim.openstreetmap.org. 1/0/0 nominatim.openstreetmap.org. [3s] AAAA 2a03:2880:f12c:183:face:b00c:0:25de (73)
E..e3b@.@.	..........5...Q.d............	nominatim.openstreetmap.org.................*.(..,........%.
    223.5.5.5.53 > 192.168.31.86.35102: [no cksum] 50864 q: AAAA? nominatim.openstreetmap.org. 1/0/1 nominatim.openstreetmap.org. [1m50s] AAAA 2a03:2880:f131:83:face:b00c:0:25de ar: . OPT UDPsize=4096 (84)
E..p..@.x..h.......V.5...\..............	nominatim.openstreetmap.org..............n..*.(..1........%...)........
    119.29.29.29.53 > 192.168.31.86.38219: [udp sum ok] 50864 q: AAAA? nominatim.openstreetmap.org. 1/0/1 nominatim.openstreetmap.org. [1m] AAAA 2a03:2880:f12c:183:face:b00c:0:25de ar: . OPT UDPsize=4096 (84)
E..p*<@.1..4w......V.5.K.\^I............	nominatim.openstreetmap.org..............<..*.(..,........%...)........
    119.29.29.29.53 > 192.168.31.86.38219: [udp sum ok] 34573 q: A? nominatim.openstreetmap.org. 1/0/1 nominatim.openstreetmap.org. [2m7s] A 104.244.43.57 ar: . OPT UDPsize=4096 (72)
E..dL0@./..Lw......V.5.K.P\.............	nominatim.openstreetmap.org.................h.+9..)........
    223.5.5.5.53 > 192.168.31.86.35102: [no cksum] 34573 q: A? nominatim.openstreetmap.org. 1/0/1 nominatim.openstreetmap.org. [1s] A 199.59.148.20 ar: . OPT UDPsize=4096 (72)


➜  chronoframe sudo tcpdump -i br-8504a2f94258 host 31.13.95.35 or host 157.240.6.35 or host 199.59.148.20
tcpdump: verbose output suppressed, use -v[v]... for full protocol decode
listening on br-8504a2f94258, link-type EN10MB (Ethernet), snapshot length 262144 bytes
10:25:29.269076 IP 172.19.0.2.47918 > r-199-59-148-20.twttr.com.https: Flags [S], seq 692185017, win 64240, options [mss 1460,sackOK,TS val 1356715957 ecr 0,nop,wscale 7], length 0
10:25:30.525423 IP 172.19.0.2.47934 > r-199-59-148-20.twttr.com.https: Flags [S], seq 3443100482, win 64240, options [mss 1460,sackOK,TS val 1356717213 ecr 0,nop,wscale 7], length 0
10:25:32.783627 IP 172.19.0.2.47946 > r-199-59-148-20.twttr.com.https: Flags [S], seq 1044360982, win 64240, options [mss 1460,sackOK,TS val 1356719472 ecr 0,nop,wscale 7], length 0
10:25:33.185032 IP 172.19.0.2.47952 > r-199-59-148-20.twttr.com.https: Flags [S], seq 3439307719, win 64240, options [mss 1460,sackOK,TS val 1356719873 ecr 0,nop,wscale 7], length 0
10:25:34.441379 IP 172.19.0.2.47964 > r-199-59-148-20.twttr.com.https: Flags [S], seq 3332845608, win 64240, options [mss 1460,sackOK,TS val 1356721129 ecr 0,nop,wscale 7], length 0
10:25:36.697060 IP 172.19.0.2.47976 > r-199-59-148-20.twttr.com.https: Flags [S], seq 1410878735, win 64240, options [mss 1460,sackOK,TS val 1356723385 ecr 0,nop,wscale 7], length 0
10:25:37.073457 IP 172.19.0.2.47982 > r-199-59-148-20.twttr.com.https: Flags [S], seq 3816177669, win 64240, options [mss 1460,sackOK,TS val 1356723761 ecr 0,nop,wscale 7], length 0
10:25:38.331574 IP 172.19.0.2.46144 > r-199-59-148-20.twttr.com.https: Flags [S], seq 2427758476, win 64240, options [mss 1460,sackOK,TS val 1356725020 ecr 0,nop,wscale 7], length 0
10:25:40.590004 IP 172.19.0.2.46160 > r-199-59-148-20.twttr.com.https: Flags [S], seq 3502192907, win 64240, options [mss 1460,sackOK,TS val 1356727278 ecr 0,nop,wscale 7], length 0

```

### 环境信息
- 项目版本：v0.14.1
- 运行环境：Docker
- 相关配置：

 ```env
# 站点信息（均可选）
NUXT_PUBLIC_APP_TITLE="Kiosk's Gallery"
NUXT_PUBLIC_APP_SLOGAN="Mems rest within the lens."
NUXT_PUBLIC_APP_AUTHOR="kiosk404"
NUXT_PUBLIC_APP_AVATAR_URL=""

# 地图提供器 (maplibre/mapbox)
NUXT_PUBLIC_MAP_PROVIDER=maplibre
# 使用 MapLibre 需要 MapTiler 访问令牌
NUXT_PUBLIC_MAP_MAPLIBRE_TOKEN=xxxxxx
NUXT_PUBLIC_MAP_MAPLIBRE_STYLE=""
# 使用 Mapbox 需要 Mapbox 访问令牌
#NUXT_PUBLIC_MAPBOX_ACCESS_TOKEN="pk.xxxxxxxxxxxxxxxxxxxxxxxxxxxxxxxxxxxxxxxxxxxxxxxxxxxxxxxxxxxxxxxxxxxxxxxxxxxxxxxx"

# Mapbox 无域名限制令牌（反向地理编码，可选）
#NUXT_MAPBOX_ACCESS_TOKEN="pk.xxxxxxxxxxxxxxxxxxxxxxxxxxxxxxxxxxxxxxxxxxxxxxxxxxxxxxxxxxxxxxxxxxxxxxxxxxxxxxxx"
NUXT_NOMINATIM_BASEURL=http://nominatim-proxy.com

# 存储提供者（local、s3 或 openlist）
NUXT_STORAGE_PROVIDER=local
NUXT_PROVIDER_LOCAL_PATH=/app/data/storage

# 会话密码（必须，32 位随机字符串）
NUXT_SESSION_PASSWORD=xxxxxxxxxxxxxxxxxxxxxxx

```

**Comment by HoshinoSuzumi** [comment]
文档有误，请尝试使用 `NUXT_NOMINATIM_BASE_URL`

**Comment by detesion** [comment]
> *预期行为：.env 配置了 NUXT_NOMINATIM_BASEURL ，预期不再访问 nominatim.openstreetmap.org , 而是访问我本地代理域名 nominatim-proxy.com。*

虽然有点不相关但是我想了解一下你的反向代理是怎样实现的，使用nginx嘛？是的话可以贴个配置吗，我一直没有弄成功来着的

**Comment by kiosk404** [comment]
> > _预期行为：.env 配置了 NUXT_NOMINATIM_BASEURL ，预期不再访问 nominatim.openstreetmap.org , 而是访问我本地代理域名 nominatim-proxy.com。_
> 
> 虽然有点不相关但是我想了解一下你的反向代理是怎样实现的，使用nginx嘛？是的话可以贴个配置吗，我一直没有弄成功来着的

你不能直接用 Nginx 反向代理到 127.0.0.1:7891（Clash 的代理端口），因为 Clash 并不是一个正常的 HTTP 上游，它需要的是 HTTP CONNECT / SOCKS5 代理协议，而 Nginx 上游只会发普通的 HTTP 请求，两边协议不匹配，Clash 会直接拒绝连接。

我这里的做法是用 gost 建一个 TCP 隧道，把目标站点的 443 流量通过 Socks5（Clash）转出去，例如：
```bash
gost -L "tcp://:19443/nominatim.openstreetmap.org:443?keepalive=true" \
     -F "socks5://127.0.0.1:7891"
```
这样本地 19443 就变成了一个“直连到 nominatim.openstreetmap.org:443 的本地端口”，底层走的是 Clash 的代理。

然后 Nginx 就可以正常反代这个本地端口：
```nginx
server {
    listen 80;
    server_name nominatim-proxy.com;

    location / {
        proxy_pass https://127.0.0.1:19443;
        proxy_ssl_verify off;
    }
}
```
因为通过 gost 已经把真实的 TLS 握手做完了，所以 Nginx 可以像反代普通 HTTPS 服务一样使用（并关闭证书校验）。

注意，这里还是用到了 nginx 的原因是因为，证书是错误的，所以用Nginx 的 `proxy_ssl_verify off;` 再把证书错误忽略掉

**Comment by kiosk404** [comment]
> > > _预期行为：.env 配置了 NUXT_NOMINATIM_BASEURL ，预期不再访问 nominatim.openstreetmap.org , 而是访问我本地代理域名 nominatim-proxy.com。_
> > 
> > 
> > 虽然有点不相关但是我想了解一下你的反向代理是怎样实现的，使用nginx嘛？是的话可以贴个配置吗，我一直没有弄成功来着的
> 
> 你不能直接用 Nginx 反向代理到 127.0.0.1:7891（Clash 的代理端口），因为 Clash 并不是一个正常的 HTTP 上游，它需要的是 HTTP CONNECT / SOCKS5 代理协议，而 Nginx 上游只会发普通的 HTTP 请求，两边协议不匹配，Clash 会直接拒绝连接。
> 
> 我这里的做法是用 gost 建一个 TCP 隧道，把目标站点的 443 流量通过 Socks5（Clash）转出去，例如：
> 
> gost -L "tcp://:19443/nominatim.openstreetmap.org:443?keepalive=true" \
>      -F "socks5://127.0.0.1:7891"
> 这样本地 19443 就变成了一个“直连到 nominatim.openstreetmap.org:443 的本地端口”，底层走的是 Clash 的代理。
> 
> 然后 Nginx 就可以正常反代这个本地端口：
> 
> server {
>     listen 80;
>     server_name nominatim-proxy.com;
> 
>     location / {
>         proxy_pass https://127.0.0.1:19443;
>         proxy_ssl_verify off;
>     }
> }
> 因为通过 gost 已经把真实的 TLS 握手做完了，所以 Nginx 可以像反代普通 HTTPS 服务一样使用（并关闭证书校验）。
> 
> 注意，这里还是用到了 nginx 的原因是因为，证书是错误的，所以用Nginx 的 `proxy_ssl_verify off;` 再把证书错误忽略掉

Of course, you can also use Clash's Tun mode :)

**Comment by detesion** [comment]
> > > _预期行为：.env 配置了 NUXT_NOMINATIM_BASEURL ，预期不再访问 nominatim.openstreetmap.org , 而是访问我本地代理域名 nominatim-proxy.com。_
> > 
> > 
> > 虽然有点不相关但是我想了解一下你的反向代理是怎样实现的，使用nginx嘛？是的话可以贴个配置吗，我一直没有弄成功来着的
> 
> 你不能直接用 Nginx 反向代理到 127.0.0.1:7891（Clash 的代理端口），因为 Clash 并不是一个正常的 HTTP 上游，它需要的是 HTTP CONNECT / SOCKS5 代理协议，而 Nginx 上游只会发普通的 HTTP 请求，两边协议不匹配，Clash 会直接拒绝连接。
> 
> 我这里的做法是用 gost 建一个 TCP 隧道，把目标站点的 443 流量通过 Socks5（Clash）转出去，例如：
> 
> gost -L "tcp://:19443/nominatim.openstreetmap.org:443?keepalive=true" \
>      -F "socks5://127.0.0.1:7891"
> 这样本地 19443 就变成了一个“直连到 nominatim.openstreetmap.org:443 的本地端口”，底层走的是 Clash 的代理。
> 
> 然后 Nginx 就可以正常反代这个本地端口：
> 
> server {
>     listen 80;
>     server_name nominatim-proxy.com;
> 
>     location / {
>         proxy_pass https://127.0.0.1:19443;
>         proxy_ssl_verify off;
>     }
> }
> 因为通过 gost 已经把真实的 TLS 握手做完了，所以 Nginx 可以像反代普通 HTTPS 服务一样使用（并关闭证书校验）。
> 
> 注意，这里还是用到了 nginx 的原因是因为，证书是错误的，所以用Nginx 的 `proxy_ssl_verify off;` 再把证书错误忽略掉

好嘞谢谢，刚刚解决了，用了台香港优化服务器nginx反代，然后设置家宽ip段访问，还是感谢老哥给了不一样的解法

**Comment by detesion** [comment]
> > > _预期行为：.env 配置了 NUXT_NOMINATIM_BASEURL ，预期不再访问 nominatim.openstreetmap.org , 而是访问我本地代理域名 nominatim-proxy.com。_
> > 
> > 
> > 虽然有点不相关但是我想了解一下你的反向代理是怎样实现的，使用nginx嘛？是的话可以贴个配置吗，我一直没有弄成功来着的
> 
> 你不能直接用 Nginx 反向代理到 127.0.0.1:7891（Clash 的代理端口），因为 Clash 并不是一个正常的 HTTP 上游，它需要的是 HTTP CONNECT / SOCKS5 代理协议，而 Nginx 上游只会发普通的 HTTP 请求，两边协议不匹配，Clash 会直接拒绝连接。
> 
> 我这里的做法是用 gost 建一个 TCP 隧道，把目标站点的 443 流量通过 Socks5（Clash）转出去，例如：
> 
> gost -L "tcp://:19443/nominatim.openstreetmap.org:443?keepalive=true" \
>      -F "socks5://127.0.0.1:7891"
> 这样本地 19443 就变成了一个“直连到 nominatim.openstreetmap.org:443 的本地端口”，底层走的是 Clash 的代理。
> 
> 然后 Nginx 就可以正常反代这个本地端口：
> 
> server {
>     listen 80;
>     server_name nominatim-proxy.com;
> 
>     location / {
>         proxy_pass https://127.0.0.1:19443;
>         proxy_ssl_verify off;
>     }
> }
> 因为通过 gost 已经把真实的 TLS 握手做完了，所以 Nginx 可以像反代普通 HTTPS 服务一样使用（并关闭证书校验）。
> 
> 注意，这里还是用到了 nginx 的原因是因为，证书是错误的，所以用Nginx 的 `proxy_ssl_verify off;` 再把证书错误忽略掉

对了，老哥既然都用Clash了，应该是mihomo内核的吧，那为何不直接通过mihomo自带的[Tunnel](https://wiki.metacubex.one/config/tunnels)配置进行隧道转发
